{
  "contract": "lat.delivery-evidence-asset-pack.v1",
  "contract_version": "1.0.0",
  "pack_id": "REPLACE_PACK_ID",
  "pack_version": "1.0.0",
  "simulation_status": "synthetic_reference",
  "downstream_adoption_status": "not_observed",
  "feature_delivery_case_id": "SYNTHETIC-CASE-ID",
  "accountable_owner": "REPLACE_PRIVATE_OWNER",
  "lattice_pin": {
    "ref": "REPLACE_WITH_IMMUTABLE_TAG_OR_SHA",
    "commit_sha": "REPLACE_WITH_FULL_40_CHARACTER_COMMIT_SHA"
  },
  "public_capabilities": [
    "skill:lattice-governor@1.2.0"
  ],
  "evidence_origin": "synthetic",
  "artifacts": {
    "feature_delivery_case": "feature-delivery-case.json",
    "evidence_ledger": "evidence-ledger.jsonl",
    "contribution_ledger": "contribution-ledger.jsonl",
    "reusable_asset_dossier": "reusable-asset-dossier.md",
    "manager_brief": "manager-brief.json",
    "validation_report": "validation-report.json"
  },
  "reusable_assets": [
    {
      "asset_id": "SYNTHETIC-ASSET-ID",
      "asset_version": "1.0.0",
      "manifest_path": "reusable-assets/SYNTHETIC-ASSET-ID/asset-manifest.json",
      "change_proposal_path": "reusable-assets/SYNTHETIC-ASSET-ID/change-proposal.json",
      "review_path": "reusable-assets/SYNTHETIC-ASSET-ID/review.json",
      "usage_observations_path": "reusable-assets/SYNTHETIC-ASSET-ID/usage-observations.jsonl"
    }
  ],
  "generated_at": "REPLACE_WITH_DATE_TIME"
}
